{
  "version": "1",
  "projectId": "carddemo",
  "generatedAt": "2026-09-19T00:00:00.000Z",
  "entries": [
    {
      "id": "program:CARDDEMO",
      "kind": "program",
      "source": {
        "language": "cobol",
        "path": "src/mainframe/CARDDEMO.cbl",
        "symbol": "CARDDEMO",
        "range": {
          "startLine": 1,
          "startColumn": 1,
          "endLine": 17,
          "endColumn": 72
        },
        "hash": "sha256:source"
      },
      "renovatio": {
        "domainNodeIds": [
          "usecase:card-demo"
        ],
        "architectureNodeIds": [
          "service:CardDemoService"
        ],
        "semanticIds": [
          "semantic:program:CARDDEMO"
        ]
      },
      "target": {
        "language": "java",
        "path": "generated/java/src/main/java/com/example/CardDemoService.java",
        "symbol": "CardDemoService",
        "range": {
          "startLine": 1,
          "startColumn": 1,
          "endLine": 12,
          "endColumn": 1
        },
        "hash": "sha256:target"
      },
      "status": "needs-review",
      "confidence": 0.86,
      "evidence": [
        ".renovatio/evidence/evaluator-summary.md"
      ],
      "lastDecision": {
        "actor": "human",
        "action": "accepted",
        "at": "2026-09-19T00:00:00.000Z",
        "reason": "Fixture baseline"
      }
    }
  ]
}
